{
  "$schema": "https://json-schema.org/draft/2020-12/schema",
  "$id": "dataset.schema.json",
  "title": "Dataset",
  "description": "A data/<id>.json file: the provenance of one source and its records.",
  "type": "object",
  "additionalProperties": false,
  "required": [
    "id",
    "source",
    "variable",
    "unit",
    "data_type",
    "spatial_resolution",
    "temporal_resolution",
    "ingestion_time",
    "processing_version",
    "records"
  ],
  "properties": {
    "id": {
      "description": "The source id in sources.toml.",
      "type": "string",
      "pattern": "^[a-z0-9]+(-[a-z0-9]+)*$"
    },
    "source": {
      "type": "object",
      "additionalProperties": false,
      "required": ["institution", "product", "url"],
      "properties": {
        "institution": { "type": "string", "minLength": 1 },
        "product": { "type": "string", "minLength": 1 },
        "url": { "description": "Download URL of the source.", "type": "string", "pattern": "^https?://" }
      }
    },
    "variable": { "description": "What is measured.", "type": "string", "minLength": 1 },
    "unit": { "type": "string", "minLength": 1 },
    "data_type": {
      "description": "The data type: observed, estimated, forecast, or official.",
      "enum": ["observed", "estimated", "forecast", "official"]
    },
    "spatial_resolution": { "type": "string", "minLength": 1 },
    "temporal_resolution": { "type": "string", "minLength": 1 },
    "reference_period": { "description": "Base period of the anomaly, if it applies.", "type": "string", "minLength": 1 },
    "ingestion_time": {
      "description": "When the data was downloaded, in ISO 8601.",
      "type": "string",
      "pattern": "^\\d{4}-\\d{2}-\\d{2}T\\d{2}:\\d{2}:\\d{2}(Z|[+-]\\d{2}:\\d{2})$"
    },
    "processing_version": { "description": "Version of the code that produced the file.", "type": "string", "minLength": 1 },
    "source_revision": {
      "description": "Revision metadata returned by the upstream source.",
      "type": "object",
      "additionalProperties": false,
      "required": ["sha256", "last_modified"],
      "properties": {
        "sha256": { "description": "SHA-256 hash of the downloaded source bytes.", "type": "string", "pattern": "^[0-9a-f]{64}$" },
        "last_modified": { "description": "HTTP Last-Modified value, when supplied.", "type": ["string", "null"] }
      }
    },
    "records": {
      "type": "array",
      "minItems": 1,
      "items": { "$ref": "#/$defs/record" }
    }
  },
  "allOf": [
    {
      "if": { "properties": { "id": { "const": "noaa-cpc-oni" } } },
      "then": { "properties": { "records": { "items": { "$ref": "#/$defs/oniRecord" } } } }
    },
    {
      "if": { "properties": { "id": { "const": "noaa-cpc-outlook" } } },
      "then": { "properties": { "records": { "items": { "$ref": "#/$defs/outlookRecord" } } } }
    },
    {
      "if": { "properties": { "id": { "const": "open-meteo-glofas" } } },
      "then": { "properties": { "records": { "items": { "$ref": "#/$defs/glofasRecord" } } } }
    },
    {
      "if": { "properties": { "id": { "const": "enfen-communique" } } },
      "then": { "properties": { "records": { "items": { "$ref": "#/$defs/enfenRecord" } } } }
    },
    {
      "if": { "properties": { "id": { "const": "noaa-oisst" } } },
      "then": {
        "properties": {
          "records": {
            "items": {
              "$ref": "#/$defs/gridRecord",
              "properties": {
                "lat": { "minItems": 90, "maxItems": 90 },
                "lon": { "minItems": 120, "maxItems": 120 },
                "anomaly": { "minItems": 90, "maxItems": 90, "items": { "minItems": 120, "maxItems": 120 } }
              }
            }
          }
        }
      }
    },
    {
      "if": { "properties": { "id": { "const": "noaa-ersst" } } },
      "then": { "properties": { "records": { "items": { "$ref": "#/$defs/ersstRecord" } } } }
    }
  ],
  "$defs": {
    "month": {
      "description": "A month in ISO 8601: YYYY-MM.",
      "type": "string",
      "pattern": "^\\d{4}-(0[1-9]|1[0-2])$"
    },
    "day": {
      "description": "A day in ISO 8601: YYYY-MM-DD.",
      "type": "string",
      "pattern": "^\\d{4}-(0[1-9]|1[0-2])-(0[1-9]|[12]\\d|3[01])$"
    },
    "record": {
      "title": "DatasetRecord",
      "description": "A value and the period it describes. The other fields depend on the source.",
      "type": "object",
      "required": ["start", "end"],
      "properties": {
        "start": { "description": "Start of the period: YYYY-MM or YYYY-MM-DD.", "type": "string", "pattern": "^\\d{4}-\\d{2}(-\\d{2})?$" },
        "end": { "description": "End of the period: YYYY-MM or YYYY-MM-DD.", "type": "string", "pattern": "^\\d{4}-\\d{2}(-\\d{2})?$" }
      },
      "additionalProperties": true
    },
    "oniRecord": {
      "title": "OniRecord",
      "description": "One rolling three-month season of the NOAA CPC ONI.",
      "type": "object",
      "additionalProperties": false,
      "required": ["season", "start", "end", "sst", "anomaly"],
      "properties": {
        "season": { "description": "Season: DJF, JFM, FMA, MAM, AMJ, MJJ, JJA, JAS, ASO, SON, OND or NDJ.", "type": "string" },
        "start": { "$ref": "#/$defs/month" },
        "end": { "$ref": "#/$defs/month" },
        "sst": { "description": "Sea surface temperature in Niño 3.4, in °C.", "type": "number" },
        "anomaly": { "description": "Anomaly of that temperature, in °C.", "type": "number" }
      }
    },
    "outlookCategory": {
      "title": "OutlookCategory",
      "description": "One NOAA CPC ENSO strength category and its probability.",
      "type": "object",
      "additionalProperties": false,
      "required": ["category", "lower_bound", "upper_bound", "probability"],
      "properties": {
        "category": { "type": "string", "minLength": 1 },
        "lower_bound": { "type": ["number", "null"] },
        "upper_bound": { "type": ["number", "null"] },
        "probability": { "type": "integer", "minimum": 0, "maximum": 100 }
      }
    },
    "outlookRecord": {
      "title": "OutlookRecord",
      "description": "One NOAA CPC ENSO strength outlook for a rolling three-month season.",
      "type": "object",
      "additionalProperties": false,
      "required": ["issue_date", "season", "start", "end", "categories"],
      "properties": {
        "issue_date": { "$ref": "#/$defs/month" },
        "season": {
          "type": "string",
          "enum": ["DJF", "JFM", "FMA", "MAM", "AMJ", "MJJ", "JJA", "JAS", "ASO", "SON", "OND", "NDJ"]
        },
        "start": { "$ref": "#/$defs/month" },
        "end": { "$ref": "#/$defs/month" },
        "categories": {
          "type": "array",
          "minItems": 9,
          "maxItems": 9,
          "items": { "$ref": "#/$defs/outlookCategory" }
        }
      }
    },
    "glofasRecord": {
      "title": "GlofasRecord",
      "description": "One daily modelled discharge value and its ensemble statistics for a named Peruvian basin point.",
      "type": "object",
      "additionalProperties": false,
      "required": [
        "point",
        "lat",
        "lon",
        "grid_lat",
        "grid_lon",
        "start",
        "end",
        "data_type",
        "river_discharge",
        "river_discharge_mean",
        "river_discharge_median",
        "river_discharge_max",
        "river_discharge_min",
        "river_discharge_p25",
        "river_discharge_p75"
      ],
      "properties": {
        "point": { "type": "string", "minLength": 1 },
        "lat": { "type": "number" },
        "lon": { "type": "number" },
        "grid_lat": { "type": "number" },
        "grid_lon": { "type": "number" },
        "start": { "$ref": "#/$defs/day" },
        "end": { "$ref": "#/$defs/day" },
        "data_type": { "enum": ["estimated", "forecast"] },
        "river_discharge": { "type": ["number", "null"], "minimum": 0 },
        "river_discharge_mean": { "type": ["number", "null"], "minimum": 0 },
        "river_discharge_median": { "type": ["number", "null"], "minimum": 0 },
        "river_discharge_max": { "type": ["number", "null"], "minimum": 0 },
        "river_discharge_min": { "type": ["number", "null"], "minimum": 0 },
        "river_discharge_p25": { "type": ["number", "null"], "minimum": 0 },
        "river_discharge_p75": { "type": ["number", "null"], "minimum": 0 }
      }
    },
    "enfenRecord": {
      "title": "EnfenRecord",
      "description": "One ENFEN official communiqué. The status holds from its date until the next-due date.",
      "type": "object",
      "additionalProperties": false,
      "required": ["number", "year", "status", "url", "start", "end", "stale"],
      "properties": {
        "number": { "description": "Communiqué number within its year.", "type": "integer", "minimum": 1 },
        "year": { "type": "integer", "minimum": 1000, "maximum": 9999 },
        "status": {
          "description": "The exact status phrase ENFEN declares.",
          "enum": [
            "No Activo",
            "Vigilancia de El Niño Costero",
            "Alerta de El Niño Costero",
            "Vigilancia de La Niña Costera",
            "Alerta de La Niña Costera"
          ]
        },
        "url": {
          "description": "The IMARPE detail page of the communiqué.",
          "type": "string",
          "pattern": "^https://enfen\\.imarpe\\.gob\\.pe/download/comunicado-oficial-enfen-n-\\d+-\\d{4}/?$"
        },
        "start": { "description": "The communiqué date.", "$ref": "#/$defs/day" },
        "end": { "description": "The next-due date the communiqué states.", "$ref": "#/$defs/day" },
        "checked_at": { "description": "The day a person last checked the archive.", "$ref": "#/$defs/day" },
        "stale": { "description": "True when the next-due date had passed at ingestion, in Lima time.", "type": "boolean" }
      }
    },
    "gridRecord": {
      "title": "GridRecord",
      "description": "One day of a regular lat/lon grid. anomaly[i][j] is the cell at lat[i] and lon[j], in °C and rounded to 2 decimals, or null where there is no value (land).",
      "type": "object",
      "additionalProperties": false,
      "required": ["start", "end", "lat", "lon", "anomaly"],
      "properties": {
        "start": { "$ref": "#/$defs/day" },
        "end": { "$ref": "#/$defs/day" },
        "lat": {
          "description": "Latitude of each row, in °N, from south to north.",
          "type": "array",
          "minItems": 1,
          "items": { "type": "number", "minimum": -90, "maximum": 90 }
        },
        "lon": {
          "description": "Longitude of each column, in °E, negative to the west, from west to east.",
          "type": "array",
          "minItems": 1,
          "items": { "type": "number", "minimum": -180, "maximum": 180 }
        },
        "anomaly": {
          "description": "Anomaly in °C, one row per lat and one value per lon in each row.",
          "type": "array",
          "minItems": 1,
          "items": {
            "type": "array",
            "minItems": 1,
            "items": { "type": ["number", "null"] }
          }
        }
      }
    },
    "ersstRecord": {
      "title": "ErsstRecord",
      "description": "One monthly ERSSTv5 anomaly for the four Niño regions.",
      "type": "object",
      "additionalProperties": false,
      "required": ["start", "end", "nino3_anomaly", "nino4_anomaly", "nino34_anomaly", "nino12_anomaly"],
      "properties": {
        "start": { "$ref": "#/$defs/month" },
        "end": { "$ref": "#/$defs/month" },
        "nino3_anomaly": { "description": "Monthly ERSSTv5 anomaly in Niño 3, in °C.", "type": "number" },
        "nino4_anomaly": { "description": "Monthly ERSSTv5 anomaly in Niño 4, in °C.", "type": "number" },
        "nino34_anomaly": { "description": "Monthly ERSSTv5 anomaly in Niño 3.4, in °C.", "type": "number" },
        "nino12_anomaly": { "description": "Monthly ERSSTv5 anomaly in Niño 1+2, in °C.", "type": "number" },
        "event": {
          "description": "ENFEN Technical Note 01-2024 event window containing this month.",
          "enum": ["1982-83", "1997-98", "2017"]
        }
      }
    }
  }
}
