{
  "id": "enfen-communique",
  "source": {
    "institution": "Comisión Multisectorial ENFEN",
    "product": "Comunicado Oficial ENFEN",
    "url": "https://enfen.imarpe.gob.pe/downloads/comunicados/"
  },
  "variable": "Estado del sistema de alerta de El Niño Costero",
  "unit": "Estado oficial",
  "data_type": "official",
  "spatial_resolution": "Costa del Perú",
  "temporal_resolution": "Por comunicado, cada dos semanas aproximadamente",
  "ingestion_time": "2026-10-02T23:14:16+00:00",
  "processing_version": "0.1.0",
  "records": [
    {
      "number": 17,
      "year": 2026,
      "status": "Alerta de El Niño Costero",
      "url": "https://enfen.imarpe.gob.pe/download/comunicado-oficial-enfen-n-17-2026/",
      "start": "2026-09-28",
      "end": "2026-10-15",
      "stale": false,
      "checked_at": "2026-10-02"
    }
  ]
}
